{"asset":{"id":"fixture.tone","version":"1.0"},"asset_content_sha256":"e5830c61ed99b43e13737c1ed7588d8a8c232da6c128cfbf508a8b926ddb9601","bins":[{"end_sample":7500,"maximum":[0.1171875,0.1171875],"minimum":[-0.1171875,-0.1171875],"rms":[0.06626907144603043,0.06626907144603043],"start_sample":0},{"end_sample":15000,"maximum":[0.1171875,0.1171875],"minimum":[-0.1171875,-0.1171875],"rms":[0.06764869606657961,0.06764869606657961],"start_sample":7500},{"end_sample":22500,"maximum":[0.1171875,0.1171875],"minimum":[-0.1171875,-0.1171875],"rms":[0.06764531259323582,0.06764531259323582],"start_sample":15000},{"end_sample":30000,"maximum":[0.1171875,0.1171875],"minimum":[-0.1171875,-0.1171875],"rms":[0.0677230897131083,0.0677230897131083],"start_sample":22500},{"end_sample":37500,"maximum":[0.1171875,0.1171875],"minimum":[-0.1171875,-0.1171875],"rms":[0.06773322797051191,0.06773322797051191],"start_sample":30000},{"end_sample":45000,"maximum":[0.1171875,0.1171875],"minimum":[-0.1171875,-0.1171875],"rms":[0.06764869606657961,0.06764869606657961],"start_sample":37500},{"end_sample":52500,"maximum":[0.1171875,0.1171875],"minimum":[-0.1171875,-0.1171875],"rms":[0.06764531259323582,0.06764531259323582],"start_sample":45000},{"end_sample":60000,"maximum":[0.1171875,0.1171875],"minimum":[-0.1171875,-0.1171875],"rms":[0.0677230897131083,0.0677230897131083],"start_sample":52500},{"end_sample":67500,"maximum":[0.1171875,0.1171875],"minimum":[-0.1171875,-0.1171875],"rms":[0.06773322797051191,0.06773322797051191],"start_sample":60000},{"end_sample":75000,"maximum":[0.1171875,0.1171875],"minimum":[-0.1171875,-0.1171875],"rms":[0.06764869606657961,0.06764869606657961],"start_sample":67500},{"end_sample":82500,"maximum":[0.1171875,0.1171875],"minimum":[-0.1171875,-0.1171875],"rms":[0.06764531259323582,0.06764531259323582],"start_sample":75000},{"end_sample":90000,"maximum":[0.1171875,0.1171875],"minimum":[-0.1171875,-0.1171875],"rms":[0.0677230897131083,0.0677230897131083],"start_sample":82500},{"end_sample":97500,"maximum":[0.1171875,0.1171875],"minimum":[-0.1171875,-0.1171875],"rms":[0.06773322797051191,0.06773322797051191],"start_sample":90000},{"end_sample":105000,"maximum":[0.1171875,0.1171875],"minimum":[-0.1171875,-0.1171875],"rms":[0.06764869606657961,0.06764869606657961],"start_sample":97500},{"end_sample":112500,"maximum":[0.1171875,0.1171875],"minimum":[-0.1171875,-0.1171875],"rms":[0.06764531259323582,0.06764531259323582],"start_sample":105000},{"end_sample":120000,"maximum":[0.1171875,0.1171875],"minimum":[-0.1171875,-0.1171875],"rms":[0.0677230897131083,0.0677230897131083],"start_sample":112500},{"end_sample":127500,"maximum":[0.1171875,0.1171875],"minimum":[-0.1171875,-0.1171875],"rms":[0.06773322797051191,0.06773322797051191],"start_sample":120000},{"end_sample":135000,"maximum":[0.1171875,0.1171875],"minimum":[-0.1171875,-0.1171875],"rms":[0.06764869606657961,0.06764869606657961],"start_sample":127500},{"end_sample":142500,"maximum":[0.1171875,0.1171875],"minimum":[-0.1171875,-0.1171875],"rms":[0.06764531259323582,0.06764531259323582],"start_sample":135000},{"end_sample":150000,"maximum":[0.1171875,0.1171875],"minimum":[-0.1171875,-0.1171875],"rms":[0.0677230897131083,0.0677230897131083],"start_sample":142500},{"end_sample":157500,"maximum":[0.1171875,0.1171875],"minimum":[-0.1171875,-0.1171875],"rms":[0.06773322797051191,0.06773322797051191],"start_sample":150000},{"end_sample":165000,"maximum":[0.1171875,0.1171875],"minimum":[-0.1171875,-0.1171875],"rms":[0.06764869606657961,0.06764869606657961],"start_sample":157500},{"end_sample":172500,"maximum":[0.1171875,0.1171875],"minimum":[-0.1171875,-0.1171875],"rms":[0.06764531259323582,0.06764531259323582],"start_sample":165000},{"end_sample":180000,"maximum":[0.1171875,0.1171875],"minimum":[-0.1171875,-0.1171875],"rms":[0.0677230897131083,0.0677230897131083],"start_sample":172500},{"end_sample":187500,"maximum":[0.1171875,0.1171875],"minimum":[-0.1171875,-0.1171875],"rms":[0.06773322797051191,0.06773322797051191],"start_sample":180000},{"end_sample":195000,"maximum":[0.1171875,0.1171875],"minimum":[-0.1171875,-0.1171875],"rms":[0.06764869606657961,0.06764869606657961],"start_sample":187500},{"end_sample":202500,"maximum":[0.1171875,0.1171875],"minimum":[-0.1171875,-0.1171875],"rms":[0.06764531259323582,0.06764531259323582],"start_sample":195000},{"end_sample":210000,"maximum":[0.1171875,0.1171875],"minimum":[-0.1171875,-0.1171875],"rms":[0.0677230897131083,0.0677230897131083],"start_sample":202500},{"end_sample":217500,"maximum":[0.1171875,0.1171875],"minimum":[-0.1171875,-0.1171875],"rms":[0.06773322797051191,0.06773322797051191],"start_sample":210000},{"end_sample":225000,"maximum":[0.1171875,0.1171875],"minimum":[-0.1171875,-0.1171875],"rms":[0.06764869606657961,0.06764869606657961],"start_sample":217500},{"end_sample":232500,"maximum":[0.1171875,0.1171875],"minimum":[-0.1171875,-0.1171875],"rms":[0.06764531259323582,0.06764531259323582],"start_sample":225000},{"end_sample":240000,"maximum":[0.1171875,0.1171875],"minimum":[-0.1171875,-0.1171875],"rms":[0.0677230897131083,0.0677230897131083],"start_sample":232500},{"end_sample":247500,"maximum":[0.1171875,0.1171875],"minimum":[-0.1171875,-0.1171875],"rms":[0.06773322797051191,0.06773322797051191],"start_sample":240000},{"end_sample":255000,"maximum":[0.1171875,0.1171875],"minimum":[-0.1171875,-0.1171875],"rms":[0.06764869606657961,0.06764869606657961],"start_sample":247500},{"end_sample":262500,"maximum":[0.1171875,0.1171875],"minimum":[-0.1171875,-0.1171875],"rms":[0.06764531259323582,0.06764531259323582],"start_sample":255000},{"end_sample":270000,"maximum":[0.1171875,0.1171875],"minimum":[-0.1171875,-0.1171875],"rms":[0.0677230897131083,0.0677230897131083],"start_sample":262500},{"end_sample":277500,"maximum":[0.1171875,0.1171875],"minimum":[-0.1171875,-0.1171875],"rms":[0.06773322797051191,0.06773322797051191],"start_sample":270000},{"end_sample":285000,"maximum":[0.1171875,0.1171875],"minimum":[-0.1171875,-0.1171875],"rms":[0.06764869606657961,0.06764869606657961],"start_sample":277500},{"end_sample":292500,"maximum":[0.1171875,0.1171875],"minimum":[-0.1171875,-0.1171875],"rms":[0.06764531259323582,0.06764531259323582],"start_sample":285000},{"end_sample":300000,"maximum":[0.1171875,0.1171875],"minimum":[-0.1171875,-0.1171875],"rms":[0.0677230897131083,0.0677230897131083],"start_sample":292500},{"end_sample":307500,"maximum":[0.1171875,0.1171875],"minimum":[-0.1171875,-0.1171875],"rms":[0.06773322797051191,0.06773322797051191],"start_sample":300000},{"end_sample":315000,"maximum":[0.1171875,0.1171875],"minimum":[-0.1171875,-0.1171875],"rms":[0.06764869606657961,0.06764869606657961],"start_sample":307500},{"end_sample":322500,"maximum":[0.1171875,0.1171875],"minimum":[-0.1171875,-0.1171875],"rms":[0.06764531259323582,0.06764531259323582],"start_sample":315000},{"end_sample":330000,"maximum":[0.1171875,0.1171875],"minimum":[-0.1171875,-0.1171875],"rms":[0.0677230897131083,0.0677230897131083],"start_sample":322500},{"end_sample":337500,"maximum":[0.1171875,0.1171875],"minimum":[-0.1171875,-0.1171875],"rms":[0.06773322797051191,0.06773322797051191],"start_sample":330000},{"end_sample":345000,"maximum":[0.1171875,0.1171875],"minimum":[-0.1171875,-0.1171875],"rms":[0.06764869606657961,0.06764869606657961],"start_sample":337500},{"end_sample":352500,"maximum":[0.1171875,0.1171875],"minimum":[-0.1171875,-0.1171875],"rms":[0.06764531259323582,0.06764531259323582],"start_sample":345000},{"end_sample":360000,"maximum":[0.1171875,0.1171875],"minimum":[-0.1171875,-0.1171875],"rms":[0.0677230897131083,0.0677230897131083],"start_sample":352500},{"end_sample":367500,"maximum":[0.1171875,0.1171875],"minimum":[-0.1171875,-0.1171875],"rms":[0.06773322797051191,0.06773322797051191],"start_sample":360000},{"end_sample":375000,"maximum":[0.1171875,0.1171875],"minimum":[-0.1171875,-0.1171875],"rms":[0.06764869606657961,0.06764869606657961],"start_sample":367500},{"end_sample":382500,"maximum":[0.1171875,0.1171875],"minimum":[-0.1171875,-0.1171875],"rms":[0.06764531259323582,0.06764531259323582],"start_sample":375000},{"end_sample":390000,"maximum":[0.1171875,0.1171875],"minimum":[-0.1171875,-0.1171875],"rms":[0.0677230897131083,0.0677230897131083],"start_sample":382500},{"end_sample":397500,"maximum":[0.1171875,0.1171875],"minimum":[-0.1171875,-0.1171875],"rms":[0.06773322797051191,0.06773322797051191],"start_sample":390000},{"end_sample":405000,"maximum":[0.1171875,0.1171875],"minimum":[-0.1171875,-0.1171875],"rms":[0.06764869606657961,0.06764869606657961],"start_sample":397500},{"end_sample":412500,"maximum":[0.1171875,0.1171875],"minimum":[-0.1171875,-0.1171875],"rms":[0.06764531259323582,0.06764531259323582],"start_sample":405000},{"end_sample":420000,"maximum":[0.1171875,0.1171875],"minimum":[-0.1171875,-0.1171875],"rms":[0.0677230897131083,0.0677230897131083],"start_sample":412500},{"end_sample":427500,"maximum":[0.1171875,0.1171875],"minimum":[-0.1171875,-0.1171875],"rms":[0.06773322797051191,0.06773322797051191],"start_sample":420000},{"end_sample":435000,"maximum":[0.1171875,0.1171875],"minimum":[-0.1171875,-0.1171875],"rms":[0.06764869606657961,0.06764869606657961],"start_sample":427500},{"end_sample":442500,"maximum":[0.1171875,0.1171875],"minimum":[-0.1171875,-0.1171875],"rms":[0.06764531259323582,0.06764531259323582],"start_sample":435000},{"end_sample":450000,"maximum":[0.1171875,0.1171875],"minimum":[-0.1171875,-0.1171875],"rms":[0.0677230897131083,0.0677230897131083],"start_sample":442500},{"end_sample":457500,"maximum":[0.1171875,0.1171875],"minimum":[-0.1171875,-0.1171875],"rms":[0.06773322797051191,0.06773322797051191],"start_sample":450000},{"end_sample":465000,"maximum":[0.1171875,0.1171875],"minimum":[-0.1171875,-0.1171875],"rms":[0.06764869606657961,0.06764869606657961],"start_sample":457500},{"end_sample":472500,"maximum":[0.1171875,0.1171875],"minimum":[-0.1171875,-0.1171875],"rms":[0.06764531259323582,0.067645